{
  "macro_overlay": {
    "status": "placeholder"
  },
  "news_impact": {
    "status": "placeholder"
  },
  "produced_at": "2026-03-30T10:32:59.851602+00:00",
  "regime": {
    "status": "placeholder"
  },
  "run_context": {
    "as_of_date": "2026-03-30",
    "code_version": "scaffold-v1",
    "created_at": "2026-03-30T10:32:59.850700+00:00",
    "market": "KR",
    "model_version": "legacy",
    "run_id": "RUN-9A4FAF8E",
    "strategy_version": "legacy-compatible"
  },
  "warnings": [
    {
      "code": "MARKET_NEWS_NOT_WIRED",
      "message": "Placeholder output only. Existing macro/news modules can be wired next.",
      "severity": "warning"
    }
  ]
}