{
  "macro_overlay": {
    "flags": [
      "VIX_HIGH",
      "VIX_RISING"
    ],
    "macro_multiplier": 1.0,
    "macro_penalty": 0.0,
    "macro_risk_score": 30.0,
    "macro_state": "NORMAL",
    "raw_context": {
      "flags": [
        "VIX_HIGH",
        "VIX_RISING"
      ],
      "krw": 1501.1800537109375,
      "krw_change_1d": -0.54,
      "macro_multiplier": 1.0,
      "macro_penalty": 0,
      "macro_risk_score": 30,
      "macro_state": "NORMAL",
      "spy_change_1d": -0.84,
      "tnx": 4.361000061035156,
      "tnx_change_1d": 0.6,
      "vix": 26.3700008392334,
      "vix_change_1d": 9.1
    },
    "status": "live_macro"
  },
  "news_impact": {
    "beneficiary_sectors": [
      "반도체"
    ],
    "cross_asset_signals": [],
    "driver_scores": {
      "EARNINGS": 5,
      "ECONOMY": 0,
      "FX": 0,
      "GEOPOLITICS": -3,
      "LIQUIDITY": -5,
      "OIL": 0,
      "POLITICS": 0,
      "RATES": 0,
      "REGULATION": 0
    },
    "key_insight": "강력한 반도체 실적 기대감이 지정학적 리스크와 국내 유동성 우려 등 외부 악재와 충돌하는 혼조세 장세입니다.",
    "macro_drivers": [
      {
        "category": "EARNINGS",
        "description": "글로벌 반도체 리더의 기록적인 실적은 코스닥 내 관련 기술주 전반의 실적 기대감을 높입니다.",
        "evidence": "삼성전자, 메모리 매출 504억달러…D램·낸드 동시 신기록",
        "market_impact": 5,
        "signal": "BULLISH"
      },
      {
        "category": "GEOPOLITICS",
        "description": "미국 증시가 중동 리스크에 반응하며 하락 출발해, 위험자산 선호 심리에 부정적 영향을 미칩니다.",
        "evidence": "뉴욕증시, 미-이란 협상 가능성 살피며 하락 출발",
        "market_impact": -3,
        "signal": "BEARISH"
      },
      {
        "category": "LIQUIDITY",
        "description": "일부 금융권의 가계대출 중단은 국내 유동성 환경에 대한 우려를 자아냅니다.",
        "evidence": "단위 농·축협 10일부터 비조합원 가계대출 중단",
        "market_impact": -2,
        "signal": "BEARISH"
      }
    ],
    "market_sentiment": "MIXED",
    "news_quality": "HIGH",
    "raw": {
      "beneficiary_keywords": [
        "메모리",
        "D램",
        "낸드"
      ],
      "beneficiary_sectors": [
        "반도체"
      ],
      "company_event_bias": {
        "넥스턴앤롤코리아": -4,
        "모아라이프플러스": -4,
        "수성웹툰": -4,
        "스코넥": -8,
        "아이티켐": -8,
        "파라택시스이더리움": 4
      },
      "cross_asset_signals": [],
      "disclosure_events": [
        {
          "category": "LIQUIDITY",
          "company": "모아라이프플러스",
          "event_score": -2,
          "label": "담보제공",
          "polarity": "NEGATIVE",
          "report_name": "[기재정정]최대주주변경을수반하는주식담보제공계약체결"
        },
        {
          "category": "LIQUIDITY",
          "company": "수성웹툰",
          "event_score": -2,
          "label": "담보제공",
          "polarity": "NEGATIVE",
          "report_name": "[기재정정]최대주주변경을수반하는주식담보제공계약체결"
        },
        {
          "category": "LIQUIDITY",
          "company": "넥스턴앤롤코리아",
          "event_score": -2,
          "label": "담보제공",
          "polarity": "NEGATIVE",
          "report_name": "최대주주변경을수반하는주식담보제공계약체결"
        },
        {
          "category": "EARNINGS",
          "company": "파라택시스이더리움",
          "event_score": 2,
          "label": "합병",
          "polarity": "POSITIVE",
          "report_name": "주요사항보고서(회사합병결정)"
        },
        {
          "category": "LIQUIDITY",
          "company": "아이티켐",
          "event_score": -5,
          "label": "전환사채",
          "polarity": "NEGATIVE",
          "report_name": "주요사항보고서(자기전환사채만기전취득결정)"
        },
        {
          "category": "LIQUIDITY",
          "company": "스코넥",
          "event_score": -5,
          "label": "전환사채",
          "polarity": "NEGATIVE",
          "report_name": "주요사항보고서(자기전환사채만기전취득결정)"
        },
        {
          "category": "LIQUIDITY",
          "company": "모아라이프플러스",
          "event_score": -2,
          "label": "담보제공",
          "polarity": "NEGATIVE",
          "report_name": "[기재정정]최대주주변경을수반하는주식담보제공계약체결"
        },
        {
          "category": "LIQUIDITY",
          "company": "수성웹툰",
          "event_score": -2,
          "label": "담보제공",
          "polarity": "NEGATIVE",
          "report_name": "[기재정정]최대주주변경을수반하는주식담보제공계약체결"
        }
      ],
      "driver_scores": {
        "EARNINGS": 5,
        "ECONOMY": 0,
        "FX": 0,
        "GEOPOLITICS": -3,
        "LIQUIDITY": -5,
        "OIL": 0,
        "POLITICS": 0,
        "RATES": 0,
        "REGULATION": 0
      },
      "evidence_headlines": [
        "삼성전자, 메모리 매출 504억달러…D램·낸드 동시 신기록 | 연합뉴스",
        "뉴욕증시, 미-이란 협상 가능성 살피며 하락 출발 | 연합뉴스",
        "[DART 20260407] 모아라이프플러스 - [기재정정]최대주주변경을수반하는주식담보제공계약체결 | 전자공시",
        "단위 농·축협 10일부터 비조합원 가계대출 중단 | 연합뉴스"
      ],
      "key_insight": "강력한 반도체 실적 기대감이 지정학적 리스크와 국내 유동성 우려 등 외부 악재와 충돌하는 혼조세 장세입니다.",
      "macro_drivers": [
        {
          "category": "EARNINGS",
          "description": "글로벌 반도체 리더의 기록적인 실적은 코스닥 내 관련 기술주 전반의 실적 기대감을 높입니다.",
          "evidence": "삼성전자, 메모리 매출 504억달러…D램·낸드 동시 신기록",
          "market_impact": 5,
          "signal": "BULLISH"
        },
        {
          "category": "GEOPOLITICS",
          "description": "미국 증시가 중동 리스크에 반응하며 하락 출발해, 위험자산 선호 심리에 부정적 영향을 미칩니다.",
          "evidence": "뉴욕증시, 미-이란 협상 가능성 살피며 하락 출발",
          "market_impact": -3,
          "signal": "BEARISH"
        },
        {
          "category": "LIQUIDITY",
          "description": "일부 금융권의 가계대출 중단은 국내 유동성 환경에 대한 우려를 자아냅니다.",
          "evidence": "단위 농·축협 10일부터 비조합원 가계대출 중단",
          "market_impact": -2,
          "signal": "BEARISH"
        }
      ],
      "market_sentiment": "MIXED",
      "news_quality": "HIGH",
      "raw_headlines": [
        "[DART 20260407] 모아라이프플러스 - [기재정정]최대주주변경을수반하는주식담보제공계약체결 | 전자공시",
        "[DART 20260407] 수성웹툰 - [기재정정]최대주주변경을수반하는주식담보제공계약체결 | 전자공시",
        "[DART 20260407] 넥스턴앤롤코리아 - 최대주주변경을수반하는주식담보제공계약체결 | 전자공시",
        "[DART 20260407] 파라택시스이더리움 - 주요사항보고서(회사합병결정) | 전자공시",
        "[DART 20260407] 아이티켐 - 주요사항보고서(자기전환사채만기전취득결정) | 전자공시",
        "[DART 20260407] 스코넥 - 주요사항보고서(자기전환사채만기전취득결정) | 전자공시",
        "[DART 20260407] 메카로 - 주요사항보고서(자기주식처분결정) | 전자공시",
        "[Tue, 7 Apr 2026 23:28:23 +0900] 뉴욕증시, 미-이란 협상 가능성 살피며 하락 출발 | 연합뉴스",
        "[Tue, 7 Apr 2026 21:05:56 +0900] [인사] 재정경제부 | 연합뉴스",
        "[Tue, 7 Apr 2026 19:54:06 +0900] 단위 농·축협 10일부터 비조합원 가계대출 중단 | 연합뉴스",
        "[Tue, 7 Apr 2026 19:49:21 +0900] 삼천당제약, '핵심 특허 대만기업 보유설'에 \"100% 자사 소유\" | 연합뉴스",
        "[Tue, 7 Apr 2026 19:31:55 +0900] 솔루스첨단소재 \"룩셈부르크 계열사 주식 784억원에 추가취득\" | 연합뉴스",
        "[Tue, 7 Apr 2026 18:32:46 +0900] 삼성전자, 메모리 매출 504억달러…D램·낸드 동시 신기록 | 연합뉴스",
        "[Tue, 7 Apr 2026 18:18:52 +0900] 포스코, 협력사 직원 7천명 정규직으로 '직접 고용'(종합) | 연합뉴스",
        "[Tue, 7 Apr 2026 18:18:38 +0900] 슈프리마, 애프터마켓서 10%대 급등 | 연합뉴스"
      ],
      "risk_flags": [
        "글로벌 증시 변동성",
        "지정학적 리스크(중동)",
        "코스닥 기업 지배구조",
        "국내 유동성 축소 우려"
      ],
      "sentiment_score": 20,
      "source": "gemini",
      "themes": [
        {
          "description": "삼성전자의 기록적인 메모리 매출은 반도체 관련 코스닥 기업에 긍정적인 신호로 작용합니다.",
          "impact": "POSITIVE",
          "theme": "반도체 업사이클"
        },
        {
          "description": "미-이란 협상 가능성에 따른 뉴욕 증시 하락은 글로벌 투자 심리를 위축시킬 수 있습니다.",
          "impact": "NEGATIVE",
          "theme": "지정학적 불확실성"
        },
        {
          "description": "최대주주 변경, 자사주/CB 취득 등 다수의 기업 공시는 개별 종목의 변동성을 높이는 요인입니다.",
          "impact": "MIXED",
          "theme": "개별 기업 지배구조 이벤트"
        }
      ],
      "timestamp": "2026-04-07 23:57",
      "victim_keywords": [
        "최대주주 변경",
        "주식담보제공",
        "가계대출"
      ],
      "victim_sectors": []
    },
    "risk_flags": [
      "글로벌 증시 변동성",
      "지정학적 리스크(중동)",
      "코스닥 기업 지배구조",
      "국내 유동성 축소 우려"
    ],
    "sentiment_score": 20,
    "source": "gemini",
    "status": "live_intel",
    "victim_sectors": []
  },
  "produced_at": "2026-04-07T14:59:01.966170+00:00",
  "regime": {
    "market": "KOSDAQ",
    "market_group": "KR",
    "status": "NORMAL",
    "support_score": 70.0
  },
  "run_context": {
    "as_of_date": "2026-04-07",
    "code_version": "bridge-v1",
    "created_at": "2026-04-07T14:58:57.356994+00:00",
    "market": "KOSDAQ",
    "model_version": "legacy",
    "run_id": "RUN-065E45E6",
    "strategy_version": "legacy-ui-v1"
  },
  "warnings": []
}