{
  "macro_overlay": {
    "flags": [
      "VIX_ELEVATED"
    ],
    "macro_multiplier": 1.0,
    "macro_penalty": 0.0,
    "macro_risk_score": 10.0,
    "macro_state": "NORMAL",
    "raw_context": {
      "flags": [
        "VIX_ELEVATED"
      ],
      "krw": 1473.780029296875,
      "krw_change_1d": -2.26,
      "macro_multiplier": 1.0,
      "macro_penalty": 0,
      "macro_risk_score": 10,
      "macro_state": "NORMAL",
      "spy_change_1d": NaN,
      "tnx": 4.335000038146973,
      "tnx_change_1d": 0.51,
      "vix": 24.170000076293945,
      "vix_change_1d": 1.26
    },
    "status": "live_macro"
  },
  "news_impact": {
    "beneficiary_sectors": [
      "방산"
    ],
    "cross_asset_signals": [
      {
        "asset": "WTI",
        "description": "원유 가격 하락은 비용 절감을 통해 KOSDAQ 시장 전반의 이익률 개선에 긍정적임.",
        "direction": "DOWN",
        "market_impact": 4
      }
    ],
    "driver_scores": {
      "EARNINGS": 1,
      "ECONOMY": 0,
      "FX": 0,
      "GEOPOLITICS": 5,
      "LIQUIDITY": -5,
      "OIL": 4,
      "POLITICS": 2,
      "RATES": 0,
      "REGULATION": -1
    },
    "key_insight": "지정학적 리스크 완화 기대감이 유가 하락을 유발하며 시장 심리를 주도하고 있으나, 개별 기업들의 자금조달 및 지배구조 관련 뉴스는 종목별 변동성을 키우는 요인임.",
    "macro_drivers": [
      {
        "category": "GEOPOLITICS",
        "description": "휴전 소식은 시장의 위험 회피 심리를 완화시키는 가장 큰 요인으로 작용함.",
        "evidence": "휴전 소식에 원유·코스피 각각 하락 베팅한 개미들 희비 교차",
        "market_impact": 5,
        "signal": "BULLISH"
      },
      {
        "category": "OIL",
        "description": "유가 하락은 KOSDAQ 내 다수 제조 기업의 비용 부담을 줄여 수익성 개선에 기여함.",
        "evidence": "휴전 소식에 원유...하락",
        "market_impact": 4,
        "signal": "BULLISH"
      },
      {
        "category": "LIQUIDITY",
        "description": "일부 KOSDAQ 상장사의 유상증자 및 최대주주 변경 공시는 개별 종목의 주주가치 희석 및 경영 불확실성 우려를 야기함.",
        "evidence": "지니틱스/스코넥-유상증자결정, 모아라이프플러스 등-최대주주변경",
        "market_impact": -2,
        "signal": "BEARISH"
      },
      {
        "category": "POLITICS",
        "description": "정부의 특정 산업(방산) 육성 정책은 관련 섹터에 대한 직접적인 모멘텀을 제공함.",
        "evidence": "중기·국방부, '모두의 챌린지 방산' 추진",
        "market_impact": 2,
        "signal": "BULLISH"
      }
    ],
    "market_sentiment": "BULLISH",
    "news_quality": "MEDIUM",
    "raw": {
      "beneficiary_keywords": [
        "방위산업"
      ],
      "beneficiary_sectors": [
        "방산"
      ],
      "company_event_bias": {
        "넥스턴앤롤코리아": -4,
        "모아라이프플러스": -4,
        "수성웹툰": -4,
        "스코넥": -8,
        "알엔투테크놀로지": -8,
        "지니틱스": -8,
        "케이씨에스": 8
      },
      "cross_asset_signals": [
        {
          "asset": "WTI",
          "description": "원유 가격 하락은 비용 절감을 통해 KOSDAQ 시장 전반의 이익률 개선에 긍정적임.",
          "direction": "DOWN",
          "market_impact": 4
        }
      ],
      "disclosure_events": [
        {
          "category": "REGULATION",
          "company": "알엔투테크놀로지",
          "event_score": -4,
          "label": "소송",
          "polarity": "NEGATIVE",
          "report_name": "소송등의판결ㆍ결정              (신주발행금지가처분)"
        },
        {
          "category": "EARNINGS",
          "company": "케이씨에스",
          "event_score": 4,
          "label": "수주/판매계약",
          "polarity": "POSITIVE",
          "report_name": "단일판매ㆍ공급계약체결"
        },
        {
          "category": "LIQUIDITY",
          "company": "지니틱스",
          "event_score": -6,
          "label": "유상증자",
          "polarity": "NEGATIVE",
          "report_name": "[기재정정]주요사항보고서(유상증자결정)"
        },
        {
          "category": "LIQUIDITY",
          "company": "모아라이프플러스",
          "event_score": -2,
          "label": "담보제공",
          "polarity": "NEGATIVE",
          "report_name": "[기재정정]최대주주변경을수반하는주식담보제공계약체결"
        },
        {
          "category": "LIQUIDITY",
          "company": "수성웹툰",
          "event_score": -2,
          "label": "담보제공",
          "polarity": "NEGATIVE",
          "report_name": "[기재정정]최대주주변경을수반하는주식담보제공계약체결"
        },
        {
          "category": "LIQUIDITY",
          "company": "스코넥",
          "event_score": -6,
          "label": "유상증자",
          "polarity": "NEGATIVE",
          "report_name": "[기재정정]주요사항보고서(유상증자결정)"
        },
        {
          "category": "LIQUIDITY",
          "company": "넥스턴앤롤코리아",
          "event_score": -2,
          "label": "담보제공",
          "polarity": "NEGATIVE",
          "report_name": "최대주주변경을수반하는주식담보제공계약체결"
        },
        {
          "category": "REGULATION",
          "company": "알엔투테크놀로지",
          "event_score": -4,
          "label": "소송",
          "polarity": "NEGATIVE",
          "report_name": "소송등의판결ㆍ결정              (신주발행금지가처분)"
        }
      ],
      "driver_scores": {
        "EARNINGS": 1,
        "ECONOMY": 0,
        "FX": 0,
        "GEOPOLITICS": 5,
        "LIQUIDITY": -5,
        "OIL": 4,
        "POLITICS": 2,
        "RATES": 0,
        "REGULATION": -1
      },
      "evidence_headlines": [
        "휴전 소식에 원유·코스피 각각 하락 베팅한 개미들 희비 교차 | 연합뉴스",
        "중기·국방부, '모두의 챌린지 방산' 추진…10개 과제 선정 | 연합뉴스",
        "[DART 20260408] 지니틱스 - [기재정정]주요사항보고서(유상증자결정) | 전자공시",
        "[DART 20260407] 모아라이프플러스 - [기재정정]최대주주변경을수반하는주식담보제공계약체결 | 전자공시"
      ],
      "key_insight": "지정학적 리스크 완화 기대감이 유가 하락을 유발하며 시장 심리를 주도하고 있으나, 개별 기업들의 자금조달 및 지배구조 관련 뉴스는 종목별 변동성을 키우는 요인임.",
      "macro_drivers": [
        {
          "category": "GEOPOLITICS",
          "description": "휴전 소식은 시장의 위험 회피 심리를 완화시키는 가장 큰 요인으로 작용함.",
          "evidence": "휴전 소식에 원유·코스피 각각 하락 베팅한 개미들 희비 교차",
          "market_impact": 5,
          "signal": "BULLISH"
        },
        {
          "category": "OIL",
          "description": "유가 하락은 KOSDAQ 내 다수 제조 기업의 비용 부담을 줄여 수익성 개선에 기여함.",
          "evidence": "휴전 소식에 원유...하락",
          "market_impact": 4,
          "signal": "BULLISH"
        },
        {
          "category": "LIQUIDITY",
          "description": "일부 KOSDAQ 상장사의 유상증자 및 최대주주 변경 공시는 개별 종목의 주주가치 희석 및 경영 불확실성 우려를 야기함.",
          "evidence": "지니틱스/스코넥-유상증자결정, 모아라이프플러스 등-최대주주변경",
          "market_impact": -2,
          "signal": "BEARISH"
        },
        {
          "category": "POLITICS",
          "description": "정부의 특정 산업(방산) 육성 정책은 관련 섹터에 대한 직접적인 모멘텀을 제공함.",
          "evidence": "중기·국방부, '모두의 챌린지 방산' 추진",
          "market_impact": 2,
          "signal": "BULLISH"
        }
      ],
      "market_sentiment": "BULLISH",
      "news_quality": "MEDIUM",
      "raw_headlines": [
        "[DART 20260408] 알엔투테크놀로지 - 소송등의판결ㆍ결정              (신주발행금지가처분) | 전자공시",
        "[DART 20260408] 케이씨에스 - 단일판매ㆍ공급계약체결 | 전자공시",
        "[DART 20260408] 지니틱스 - [기재정정]주요사항보고서(유상증자결정) | 전자공시",
        "[DART 20260407] 모아라이프플러스 - [기재정정]최대주주변경을수반하는주식담보제공계약체결 | 전자공시",
        "[DART 20260407] 수성웹툰 - [기재정정]최대주주변경을수반하는주식담보제공계약체결 | 전자공시",
        "[DART 20260408] 스코넥 - [기재정정]주요사항보고서(유상증자결정) | 전자공시",
        "[DART 20260407] 넥스턴앤롤코리아 - 최대주주변경을수반하는주식담보제공계약체결 | 전자공시",
        "[Wed, 8 Apr 2026 14:08:13 +0900] BNK경남은행, 적십자사 특별회비 4천만원 납부…\"나눔가치 실천\" | 연합뉴스",
        "[Wed, 8 Apr 2026 14:03:41 +0900] 전주시, 청년 1인 소상공인·농어업인에 출산급여…최대 90만원 | 연합뉴스",
        "[Wed, 8 Apr 2026 14:00:15 +0900] 중기·국방부, '모두의 챌린지 방산' 추진…10개 과제 선정 | 연합뉴스",
        "[Wed, 8 Apr 2026 14:00:15 +0900] 부산 해운대·화명 통합재건축 본격화…비수도권 최초 고시 | 연합뉴스",
        "[Wed, 8 Apr 2026 14:00:06 +0900] [게시판] 공정위·금감원, 금융 분야 불공정약관 개선을 위한 설명회 개최 | 연합뉴스",
        "[Wed, 8 Apr 2026 14:00:06 +0900] 재경차관 \"국유재산 활용 주택 신속 공급…주거안정 총력\" | 연합뉴스",
        "[Wed, 8 Apr 2026 13:56:40 +0900] 포스코 협력사 7천명 직접고용 '파격'…전환대상·방식에 관심 | 연합뉴스",
        "[Wed, 8 Apr 2026 13:06:01 +0900] 휴전 소식에 원유·코스피 각각 하락 베팅한 개미들 희비 교차 | 연합뉴스"
      ],
      "risk_flags": [
        "개별 기업 자금조달 리스크",
        "최대주주 변경 관련 경영 불확실성"
      ],
      "sentiment_score": 65,
      "source": "gemini",
      "themes": [
        {
          "description": "휴전 가능성이 제기되면서 원자재 가격 안정 및 투자 심리 개선 기대감이 형성됨.",
          "impact": "POSITIVE",
          "theme": "지정학적 리스크 완화"
        },
        {
          "description": "중소벤처기업부와 국방부의 방위 산업 지원 정책으로 관련 기업에 대한 수혜가 예상됨.",
          "impact": "POSITIVE",
          "theme": "정부 방위 산업 육성"
        }
      ],
      "timestamp": "2026-04-08 14:12",
      "victim_keywords": [
        "유상증자",
        "최대주주 변경",
        "신주발행금지가처분"
      ],
      "victim_sectors": []
    },
    "risk_flags": [
      "개별 기업 자금조달 리스크",
      "최대주주 변경 관련 경영 불확실성"
    ],
    "sentiment_score": 65,
    "source": "gemini",
    "status": "live_intel",
    "victim_sectors": []
  },
  "produced_at": "2026-04-08T05:12:36.530018+00:00",
  "regime": {
    "market": "KOSDAQ",
    "market_group": "KR",
    "status": "NORMAL",
    "support_score": 90.0
  },
  "run_context": {
    "as_of_date": "2026-04-08",
    "code_version": "bridge-v1",
    "created_at": "2026-04-08T05:11:15.634741+00:00",
    "market": "KOSDAQ",
    "model_version": "legacy",
    "run_id": "RUN-3996D8F1",
    "strategy_version": "legacy-ui-v1"
  },
  "warnings": []
}