{
  "macro_overlay": {
    "note": "Wire modules/macro_scheduler.py for live regime overlay.",
    "status": "not_wired"
  },
  "news_impact": {
    "note": "Wire modules/market_intelligence.py and modules/news_analysis.py next.",
    "status": "not_wired"
  },
  "produced_at": "2026-03-30T14:13:31.812237+00:00",
  "regime": {
    "market": "KR",
    "market_group": "KR",
    "status": "UNKNOWN",
    "support_score": null
  },
  "run_context": {
    "as_of_date": "2026-03-30",
    "code_version": "scaffold-v1",
    "created_at": "2026-03-30T14:13:31.798729+00:00",
    "market": "KR",
    "model_version": "legacy",
    "run_id": "RUN-298F0606",
    "strategy_version": "legacy-compatible"
  },
  "warnings": [
    {
      "code": "MACRO_CONTEXT_FETCH_FAIL",
      "message": "Macro context fetch failed: No module named 'yfinance'",
      "severity": "warning"
    },
    {
      "code": "NEWS_CONTEXT_FETCH_FAIL",
      "message": "News context fetch failed: No module named 'feedparser'",
      "severity": "warning"
    }
  ]
}