{
  "macro_overlay": {
    "flags": [
      "VIX_HIGH",
      "KRW_WEAKNESS"
    ],
    "macro_multiplier": 0.85,
    "macro_penalty": 5.0,
    "macro_risk_score": 35.0,
    "macro_state": "CAUTION",
    "raw_context": {
      "flags": [
        "VIX_HIGH",
        "KRW_WEAKNESS"
      ],
      "krw": 1531.1700439453125,
      "krw_change_1d": 1.6,
      "macro_multiplier": 0.85,
      "macro_penalty": 5,
      "macro_risk_score": 35,
      "macro_state": "CAUTION",
      "spy_change_1d": -0.33,
      "tnx": 4.3420000076293945,
      "tnx_change_1d": -2.21,
      "vix": 28.889999389648438,
      "vix_change_1d": -5.62
    },
    "status": "live_macro"
  },
  "news_impact": {
    "beneficiary_sectors": [],
    "key_insight": "No intelligence available",
    "market_sentiment": "NEUTRAL",
    "raw": {
      "beneficiary_keywords": [],
      "beneficiary_sectors": [],
      "key_insight": "No intelligence available",
      "market_sentiment": "NEUTRAL",
      "raw_headlines": [],
      "sentiment_score": 0,
      "source": "fallback",
      "themes": [],
      "victim_keywords": [],
      "victim_sectors": []
    },
    "sentiment_score": 0,
    "source": "fallback",
    "status": "fallback_intel",
    "victim_sectors": []
  },
  "produced_at": "2026-03-31T08:42:14.947026+00:00",
  "regime": {
    "market": "KOSPI",
    "market_group": "KR",
    "status": "CAUTION",
    "support_score": 65.0
  },
  "run_context": {
    "as_of_date": "2026-03-31",
    "code_version": "smoke-check",
    "created_at": "2026-03-31T08:42:13.179682+00:00",
    "market": "KOSPI",
    "model_version": "legacy",
    "run_id": "RUN-8AF923BE",
    "strategy_version": "smoke-check"
  },
  "warnings": [
    {
      "code": "NEWS_INTEL_FALLBACK",
      "message": "News intelligence returned fallback payload.",
      "severity": "warning"
    }
  ]
}