{
  "macro_overlay": {
    "note": "Wire modules/macro_scheduler.py for live regime overlay.",
    "status": "not_wired"
  },
  "news_impact": {
    "note": "Wire modules/market_intelligence.py and modules/news_analysis.py next.",
    "status": "not_wired"
  },
  "produced_at": "2026-03-30T13:02:56.268391+00:00",
  "regime": {
    "market": "US",
    "market_group": "US",
    "status": "UNKNOWN",
    "support_score": null
  },
  "run_context": {
    "as_of_date": "2026-03-30",
    "code_version": "bridge-v1",
    "created_at": "2026-03-30T13:02:56.267671+00:00",
    "market": "US",
    "model_version": "legacy",
    "run_id": "RUN-049DBBA2",
    "strategy_version": "bridge-smoke-v10"
  },
  "warnings": [
    {
      "code": "MARKET_CONTEXT_NOT_WIRED",
      "message": "Market/news context is placeholder in this bridge stage.",
      "severity": "warning"
    }
  ]
}